mysql> 
mysql> 
mysql> 
mysql> /*                                         INSERT INTO CLAUSE                                             */
mysql> 
mysql> -- EX
mysql> 
mysql> -- CREATING A DUMMY TABLE 
mysql> 
mysql> CREATE TABLE CUST_DUMMY 
    -> (CID Number(2) primary key ,
    -> CNAME Varchar(10) ,
    -> CNO Number(10) not null check( length( CNO ) = 10 ) ,
    -> ADDRESS Varchar(15) 
    -> );
ERROR 1064 (42000): You have an error in your SQL syntax; check the manual that corresponds to your MySQL server version for the right syntax to use near 'Number(2) primary key ,
CNAME Varchar(10) ,
CNO Number(10) not null check( lengt' at line 2
mysql> 
mysql> 
mysql> CREATE TABLE CUST_DUMMY (
    ->     CID INT PRIMARY KEY,
    ->     CNAME VARCHAR(10),
    ->     CNO VARCHAR(10) NOT NULL,
    ->     ADDRESS VARCHAR(15),
    ->     CONSTRAINT chk_cno_length CHECK (LENGTH(CNO) = 10)
    -> );   
Query OK, 0 rows affected (0.04 sec)

mysql> 
mysql> -- EX
mysql> 
mysql> INSERT INTO CUST_DUMMY VALUES(1, 'DINGA', 1234567890, 'ADD 1');
Query OK, 1 row affected (0.01 sec)

mysql> 
mysql> 
mysql> -- EX
mysql> 
mysql> INSERT INTO CUST_DUMMY VALUES(2, 'DINGI', 1231231231, 'ADD 2');
Query OK, 1 row affected (0.00 sec)

mysql> 
mysql> 
mysql> 
mysql> 
mysql> /*                                                       UPDATE CLAUSE                                                     */
mysql> 
mysql> -- EX
mysql> 
mysql> UPDATE CUST_DUMMY 
    -> SET CNO = 1234512345
    -> WHERE ENAME = 'DINGA''
    '> ^C
mysql> 
mysql> 
mysql> UPDATE CUST_DUMMY
    -> SET CNO = 1234512345
    -> WHERE ENAME = 'DINGA';
ERROR 1054 (42S22): Unknown column 'ENAME' in 'where clause'
mysql> 
mysql> 
mysql> UPDATE CUST_DUMMY
    -> SET CNO = 1234512345
    -> WHERE CNAME = 'DINGA';
Query OK, 1 row affected (0.00 sec)
Rows matched: 1  Changed: 1  Warnings: 0

mysql> 
mysql> -- VERIFICATION
mysql> 
mysql> SELECT * FROM CUST_DUMMY;
+-----+-------+------------+---------+
| CID | CNAME | CNO        | ADDRESS |
+-----+-------+------------+---------+
|   1 | DINGA | 1234512345 | ADD 1   |
|   2 | DINGI | 1231231231 | ADD 2   |
+-----+-------+------------+---------+
2 rows in set (0.00 sec)

mysql> 
mysql> 
mysql> -- EX
mysql> 
mysql> UPDATE CUST_DUMMY
    -> SET ADDRESS = 'MYSORE'
    -> WHERE CNO = 1;
Query OK, 0 rows affected (0.00 sec)
Rows matched: 0  Changed: 0  Warnings: 0

mysql> 
mysql> -- VERIFICATION
mysql> 
mysql> SELECT * FROM CUST_DUMMY;
+-----+-------+------------+---------+
| CID | CNAME | CNO        | ADDRESS |
+-----+-------+------------+---------+
|   1 | DINGA | 1234512345 | ADD 1   |
|   2 | DINGI | 1231231231 | ADD 2   |
+-----+-------+------------+---------+
2 rows in set (0.00 sec)

mysql> 
mysql> 
mysql> /*                                                                        DELETE CLAUSE                                                                       */
mysql> 
mysql> 
mysql> DELETE FROM DUMMY_CUST
    -> WHERE CNAME = 'DINGI';
ERROR 1146 (42S02): Table 'abdulrahmandb.dummy_cust' doesn't exist
mysql> 
mysql> 
mysql> DELETE FROM CUST_DUMMY
    -> WHERE CNAME = 'DINGI';
Query OK, 1 row affected (0.01 sec)

mysql> 
mysql> 
mysql> -- VERIFICATION
mysql> 
mysql> SELECT * FROM CUST_DUMMY;
+-----+-------+------------+---------+
| CID | CNAME | CNO        | ADDRESS |
+-----+-------+------------+---------+
|   1 | DINGA | 1234512345 | ADD 1   |
+-----+-------+------------+---------+
1 row in set (0.00 sec)

mysql> 
mysql> 
mysql> 
mysql> /*                                                                     ASSIGNMENT QUESTIONS                                                                   */
mysql> 
mysql> -- MAKING A DUMMY EMP TABLE TO PERFORM DML OPERATIONS
mysql> 
mysql> CREATE TABLE EMP_DUMMY
    -> AS SELECT * FROM EMP;
Query OK, 14 rows affected (0.03 sec)
Records: 14  Duplicates: 0  Warnings: 0

mysql> 
mysql> 
mysql> -- Q1
mysql> 
mysql> UPDATE TABLE EMP_DUMMY
    -> 
    -> 
    -> NOTEE
    -> 
    -> ;
ERROR 1064 (42000): You have an error in your SQL syntax; check the manual that corresponds to your MySQL server version for the right syntax to use near 'TABLE EMP_DUMMY


NOTEE' at line 1
mysql> NOTEE
